{
  "schema": "cac.holonic_principle.v1",
  "schema_version": "1.0.0",
  "kind": "holonic.principle",
  "meta": {
    "stable_id": "dcp://apm2.agents/holon/principle/ebpf@1",
    "classification": "PUBLIC",
    "created_at": "2026-02-04T00:00:00Z"
  },
  "payload": {
    "id": 33,
    "name": "ebpf",
    "title": "eBPF: programmable measurement/enforcement close to substrate",
    "formal": "attach programs at kernel hook points for observability and policy.",
    "apm2_mapping": "eBPF is an ideal *observability amplifier* for APM2: you can measure per-tool syscall patterns, detect unexpected egress, and feed that into gates as receipts. Treat this as \u201chardware telemetry\u201d for the governance controller.",
    "connections": [
      65,
      66,
      91,
      92
    ]
  }
}