{
  "schema": "cac.holonic_principle.v1",
  "schema_version": "1.0.0",
  "kind": "holonic.principle",
  "meta": {
    "stable_id": "dcp://apm2.agents/holon/principle/configuration-drift-is-inevitable-detect-and-remediate-continuously@1",
    "classification": "PUBLIC",
    "created_at": "2026-02-04T00:00:00Z"
  },
  "payload": {
    "id": 60,
    "name": "configuration-drift-is-inevitable-detect-and-remediate-continuously",
    "title": "Configuration drift is inevitable; detect and remediate continuously",
    "formal": "drift = observed \u2260 desired; remediation must be audited.",
    "apm2_mapping": "in global deployments, drift is both reliability and security risk. Drift remediation must emit evidence (what changed, why, by whom, which capability).",
    "connections": [
      92,
      93
    ]
  }
}