{
  "schema": "cac.holonic_principle.v1",
  "schema_version": "1.0.0",
  "kind": "holonic.principle",
  "meta": {
    "stable_id": "dcp://apm2.agents/holon/principle/backpressure@1",
    "classification": "PUBLIC",
    "created_at": "2026-02-04T00:00:00Z"
  },
  "payload": {
    "id": 53,
    "name": "backpressure",
    "title": "Backpressure: the only honest overload strategy",
    "formal": "when downstream cannot process, upstream must slow/stop; otherwise queues explode.",
    "apm2_mapping": "APM2 already implements backpressure in resource governance for pulse subscriptions and in budgets for sessions. Push it everywhere: tool execution pools, replication streams, CI import, gate evaluation. Also: treat \u201ccannot accept work\u201d as a normal outcome, not an error.",
    "connections": [
      9,
      25,
      27
    ]
  }
}