{
  "schema": "cac.holonic_principle.v1",
  "schema_version": "1.0.0",
  "kind": "holonic.principle",
  "meta": {
    "stable_id": "dcp://apm2.agents/holon/principle/lattice-theory-monotone-frameworks@1",
    "classification": "PUBLIC",
    "created_at": "2026-02-04T00:00:00Z"
  },
  "payload": {
    "id": 71,
    "name": "lattice-theory-monotone-frameworks",
    "title": "Lattice theory + monotone frameworks: explain convergence and termination",
    "formal": "if (f) is monotone on a complete lattice, iterating from (\\bot) converges to (\\mathrm{lfp}(f)).",
    "apm2_mapping": "permissions and delegation are lattices; CRDTs are semilattices; policy evaluation should be monotone and terminating. This is not abstract math\u2014it\u2019s how you guarantee no permission propagation loops and no non-terminating reconciliation.",
    "connections": [
      38,
      51,
      72
    ]
  }
}