{
  "schema": "cac.holonic_principle.v1",
  "schema_version": "1.0.0",
  "kind": "holonic.principle",
  "meta": {
    "stable_id": "dcp://apm2.agents/holon/principle/memory-tiers-hbm-dram-ssd-object-store@1",
    "classification": "PUBLIC",
    "created_at": "2026-02-04T00:00:00Z"
  },
  "payload": {
    "id": 21,
    "name": "memory-tiers-hbm-dram-ssd-object-store",
    "title": "Memory tiers (HBM/DRAM/SSD/object store): map cognitive tiers explicitly",
    "formal": "latency/cost hierarchy demands explicit placement and eviction.",
    "apm2_mapping": "APM2 already has:\n\n* **working context** (episode/session),\n* **episodic ledger** (append-only events),\n* **artifacts/evidence** (CAS),\n* and likely a **semantic index** (future).\n  Make tiering explicit: working memory is lossy; ledger+CAS are authoritative. Anything you can\u2019t replay from ledger+CAS is a design defect.",
    "connections": [
      45,
      46,
      47,
      96
    ]
  }
}