{
  "schema": "cac.holonic_principle.v1",
  "schema_version": "1.0.0",
  "kind": "holonic.principle",
  "meta": {
    "stable_id": "dcp://apm2.agents/holon/principle/kv-cache-is-a-physical-resource-budget-it-like-os-pages@1",
    "classification": "PUBLIC",
    "created_at": "2026-02-04T00:00:00Z"
  },
  "payload": {
    "id": 15,
    "name": "kv-cache-is-a-physical-resource-budget-it-like-os-pages",
    "title": "KV-cache is a physical resource; budget it like OS pages",
    "formal": "KV-cache capacity (M) limits concurrent sequences; eviction policy affects recomputation.",
    "apm2_mapping": "**agent working memory is KV-cache**. ContextPacks are effectively \u201cpinned pages.\u201d Budget token/context per lease and per risk class. If a task requires more context than allowed, that\u2019s a *context defect* (pack miss) and should be logged as such, not worked around by \u201cjust retrieve more.\u201d",
    "connections": [
      3,
      4,
      5,
      96,
      97
    ]
  }
}