{
  "schema": "cac.holonic_principle.v1",
  "schema_version": "1.0.0",
  "kind": "holonic.principle",
  "meta": {
    "stable_id": "dcp://apm2.agents/holon/principle/circuit-breakers@1",
    "classification": "PUBLIC",
    "created_at": "2026-02-04T00:00:00Z"
  },
  "payload": {
    "id": 54,
    "name": "circuit-breakers",
    "title": "Circuit breakers: prevent cascading failures",
    "formal": "open circuit after repeated failures; half-open to test recovery.",
    "apm2_mapping": "apply to external dependencies (LLM providers, GitHub API, artifact stores). The breaker state should be visible in the ledger or in a projection so it can be audited and tuned, not hidden in logs.",
    "connections": [
      63,
      64
    ]
  }
}