{
  "schema": "cac.holonic_principle.v1",
  "schema_version": "1.0.0",
  "kind": "holonic.principle",
  "meta": {
    "stable_id": "dcp://apm2.agents/holon/principle/pomdps@1",
    "classification": "PUBLIC",
    "created_at": "2026-02-04T00:00:00Z"
  },
  "payload": {
    "id": 79,
    "name": "pomdps",
    "title": "POMDPs: partial observability requires belief states",
    "formal": "maintain belief (b(s)) over hidden state; update with observations.",
    "apm2_mapping": "agents do not observe the world fully; tool outputs are partial and sometimes adversarial. Maintain belief states tied to evidence, not narratives. This is exactly why APM2 treats tool outputs as untrusted until verified/hashed/stored.",
    "connections": [
      76,
      88,
      89,
      90
    ]
  }
}