{
  "schema": "cac.holonic_principle.v1",
  "schema_version": "1.0.0",
  "kind": "holonic.principle",
  "meta": {
    "stable_id": "dcp://apm2.agents/holon/principle/work-graphs-as-dags@1",
    "classification": "PUBLIC",
    "created_at": "2026-02-04T00:00:00Z"
  },
  "payload": {
    "id": 95,
    "name": "work-graphs-as-dags",
    "title": "Work graphs as DAGs: ordering must be explicit and replayable",
    "formal": "represent work as state machines + DAG edges; replay derives state.",
    "apm2_mapping": "the work module already includes parent_work_ids and immutable spec_snapshot_hash. The right posture is: **work is a replayable automaton**, not a chat log. \u201cConversation\u201d is a projection; the ledger is truth.",
    "connections": [
      47,
      50
    ]
  }
}