{
  "schema": "cac.holonic_principle.v1",
  "schema_version": "1.0.0",
  "kind": "holonic.principle",
  "meta": {
    "stable_id": "dcp://apm2.agents/holon/principle/speculative-decoding@1",
    "classification": "PUBLIC",
    "created_at": "2026-02-04T00:00:00Z"
  },
  "payload": {
    "id": 16,
    "name": "speculative-decoding",
    "title": "Speculative decoding: trade extra compute for latency by \u201cbetting\u201d on tokens",
    "formal": "speculative decoding uses a draft model; accept if verifier agrees, otherwise rollback.",
    "apm2_mapping": "speculative decoding is **optimistic execution + verification**. That\u2019s the APM2 pattern in general: agents propose actions; gates verify; ledger commits. The key is rollback safety: all side effects must be idempotent and capability-scoped (48, 38). Use speculation for low-risk steps (formatting, lint fixes), but require receipts before promotion.",
    "connections": [
      48,
      63,
      94
    ]
  }
}