{
  "schema": "cac.holonic_principle.v1",
  "schema_version": "1.0.0",
  "kind": "holonic.principle",
  "meta": {
    "stable_id": "dcp://apm2.agents/holon/principle/policy-as-code-with-signed-bundles@1",
    "classification": "PUBLIC",
    "created_at": "2026-02-04T00:00:00Z"
  },
  "payload": {
    "id": 93,
    "name": "policy-as-code-with-signed-bundles",
    "title": "Policy-as-code with signed bundles: distributable governance with consistent enforcement",
    "formal": "policy hash (h(P)) is the governance identity; enforcement requires exact match.",
    "apm2_mapping": "every holon must enforce the same policy hash for a given risk tier before acting. Signed policy bundles prevent drift and downgrade.",
    "connections": [
      41,
      60
    ]
  }
}