{
  "schema": "cac.holonic_principle.v1",
  "schema_version": "1.0.0",
  "kind": "holonic.principle",
  "meta": {
    "stable_id": "dcp://apm2.agents/holon/principle/fair-scheduling-weighted-queuing@1",
    "classification": "PUBLIC",
    "created_at": "2026-02-04T00:00:00Z"
  },
  "payload": {
    "id": 57,
    "name": "fair-scheduling-weighted-queuing",
    "title": "Fair scheduling + weighted queuing: prevent starvation",
    "formal": "allocate service according to weights; avoid head-of-line blocking.",
    "apm2_mapping": "APM2 should weight by **risk tier**, **SLO**, and **tenant**. \u201cOne noisy agent\u201d must not starve governance-critical loops (leases, capability revocation, ledger append). Encode fairness in schedulers and in HEF drop policy priorities.",
    "connections": [
      25,
      94
    ]
  }
}