{
  "schema": "cac.holonic_principle.v1",
  "schema_version": "1.0.0",
  "kind": "holonic.principle",
  "meta": {
    "stable_id": "dcp://apm2.agents/holon/principle/category-theory@1",
    "classification": "PUBLIC",
    "created_at": "2026-02-04T00:00:00Z"
  },
  "payload": {
    "id": 73,
    "name": "category-theory",
    "title": "Category theory: compositional interfaces with identity + associativity",
    "formal": "morphisms compose; identities exist; compositionality reduces complexity.",
    "apm2_mapping": "holon interfaces should compose: work intake \u2192 episode execution \u2192 artifact emission \u2192 escalation. Tool invocations should also be composable pipelines with explicit handlers (74). The point is to build large systems from small verified pieces without \u201cglue code entropy.\u201d",
    "connections": [
      74,
      95
    ]
  }
}