{
  "schema": "cac.holonic_principle.v1",
  "schema_version": "1.0.0",
  "kind": "holonic.principle",
  "meta": {
    "stable_id": "dcp://apm2.agents/holon/principle/batching@1",
    "classification": "PUBLIC",
    "created_at": "2026-02-04T00:00:00Z"
  },
  "payload": {
    "id": 8,
    "name": "batching",
    "title": "Batching: amortize overhead but trade for tail latency",
    "formal": "batching lowers per-request fixed cost, increases waiting time. Queueing theory: batching inflates (W) even if service time drops.",
    "apm2_mapping": "APM2 already batches ledger reads in reducer replay and rate-limits/paces pulses. But you need explicit **batch policies by risk tier**: high-risk actions (deploy, key ops) should *not* wait for throughput optimization. Low-risk telemetry can batch aggressively. Encode these policies as part of resource governance and gate scheduling.",
    "connections": [
      9,
      26,
      27,
      28,
      29,
      94
    ]
  }
}