{
  "schema": "cac.holonic_principle.v1",
  "schema_version": "1.0.0",
  "kind": "holonic.principle",
  "meta": {
    "stable_id": "dcp://apm2.agents/holon/principle/remote-attestation@1",
    "classification": "PUBLIC",
    "created_at": "2026-02-04T00:00:00Z"
  },
  "payload": {
    "id": 37,
    "name": "remote-attestation",
    "title": "Remote attestation: trust becomes a verifiable claim",
    "formal": "prove to a verifier that the prover is running approved code/config, typically using TPM quotes or enclave attestation.",
    "apm2_mapping": "any node receiving authority (capabilities, keys, deployment power) must present attestation *before* delegation. This aligns with APM2\u2019s \u201cfail-closed\u201d posture: if attestation missing/unverifiable, deny.",
    "connections": [
      38,
      93,
      94
    ]
  }
}