{
  "schema": "cac.holonic_principle.v1",
  "schema_version": "1.0.0",
  "kind": "holonic.principle",
  "meta": {
    "stable_id": "dcp://apm2.agents/holon/principle/numa-locality@1",
    "classification": "PUBLIC",
    "created_at": "2026-02-04T00:00:00Z"
  },
  "payload": {
    "id": 20,
    "name": "numa-locality",
    "title": "NUMA locality: \u201cone rack\u201d isn\u2019t uniform memory",
    "formal": "remote NUMA accesses cost more; thread/page placement matters.",
    "apm2_mapping": "the analog is \u201cone trust domain isn\u2019t uniform authority.\u201d Inside a rack, some executors should still be isolated (side channels, secrets). Pin high\u2011risk workloads to isolated domains (35). Also pin data-plane heavy tasks near their storage.",
    "connections": [
      34,
      35,
      55
    ]
  }
}